PopularName,SchoolId,Classification,ProperName,NickName,matches
burlington robert bateman (cn),6849,,robert bateman (lord elgin) hs,,
richton park rich south (il),6851,,rich south hs,,"capstone academy charter school sda south campus, forest park school"
addison trail (il),6852,,addison trail hs,,
berwyn morton (il),6853,,morton hs,,
franklin park leyden (il),6854,,leyden hs,,progress park
villa park willowbrook (il),6855,,willowbrook hs,,progress park
chicago hirsch (il),6856,,hirsch hs,,
mississippi school for the deaf (ms),6857,,mississippi school for the deaf (ms),,"actech high school, addison high school"
youngstown east (oh),6858,,east hs,,"covenant house academy detroit east site, east english village preparatory academy"
burlington notre dame (cn),6859,,notre dame hs,,notre dame preparatory school & marist academy
burlington central (cn),6860,,central hs,,"central michigan correctional facility, central montcalm middle high school"
duluth marshall (mn),6861,,marshall hs,,marshall opportunity high school
innisfil nantyr shores (cn),6862,,nantyr shores hs,,
west salem (wi),6863,,west salem hs,,"academy west alternative education, david ellis academy west"
wisconsin dells (wi),6864,,wisconsin dells hs,,
crete monee (il),6865,,crete-monee hs,,
chicago longwood academy (il),6866,,longwood academy,,"academy 21, academy for business and technology high school"
evansville fj reitz (in),6867,,evansville fj reitz hs,,
churubusco (in),6868,,churubusco hs,Eagles,arts academy in the woods
hammond bishop noll (in),6869,,bishop noll hs,,
north newton (in),6870,,north newton hs,,"arts academy in the woods, grosse pointe north high school"
eden prarie (mn),6871,,eden prairie hs,,
burnsville (mn),6872,,burnsville hs,,
jeffersonville (in),6873,,jeffersonville hs,,
newburgh castle (in),6874,,castle hs,,
evansville harrison (in),6875,,evansville harrison hs,,harrison center
evansville reitz (in),6876,,evansville reitz memorial hs,,
evansville central (in),6877,,evansville central hs,,"central michigan correctional facility, central montcalm middle high school"
evansville north (in),6878,,evansville north hs,,"grosse pointe north high school, lighthouse academy north campus"
evansville bosse (in),6879,,evansville bosse hs,,
evansville mater dei (in),6880,,evansville master del hs,,
gary bowman academy (in),6881,,thea bowman academy,,"academic and career education academy, academy 21"
union grove (wi),6882,,union grove hs,,"chesaning union high school, chesaning union schools alternative education"
manitowoc roncalli hs (wi),6883,,roncalli hs,,
cleveland willoughby south (oh),6884,,willoughby south,,"capstone academy charter school sda south campus, way south haven"
cincinnati winton woods (oh),6885,,winton woods,,the harper woods college and career institute
st francis (wi),6886,,st. francis,,"link learning st louis, st charles community middlehigh school"
new berlin eisenhower (wi),6887,,eisenhower,,"new beginnings alternative high school, new school high"
brown deer (wi),6888,,brown deer,,brown city high school
greenfield whitnall (wi),6889,,whitnall,,
bradley-bourbonnais coummunity (il),6890,,bradley-bourbonnais coummunity hs,,
game wanted,6891,,game wanted,,
open league,6892,,open league,,
portland jay county (in),6893,,portland jay county hs,,"allegan county area technical and education center, alternative educational academy of iosco county"
detroit public schools league,6912,,detroit public schools league,,"chesaning union schools alternative education, covenant house academy detroit southwest site"
new haven merritt academy,7341,D,merritt academy hs,Mustangs,"merritt academy, academy 21"
pontiac,7342,A,pontiac hs,Phoenix,"arts and technology academy of pontiac, life skills center of pontiac"
kalamazoo phoenix,7343,D,phoenix hs,Phoenix Fury,"kalamazoo area math and science center, kalamazoo central high school"
detroit plymouth educational center,7344,,plymouth educational center prep hs,Panthers,"apollo center, bay pines center"
ann arbor clonlara,7345,,clonlara school,,"ann arbor learning community, arbor preparatory high school"
clarkston everest collegiate,7346,D,everest collegiate hs,Mountaineers,"detroit collegiate preparatory high school at northwestern, everest academy"
detroit frontier international,7347,B,frontier international academy,Frontier Knights,"american international academy high schoolmiddle schooll, covenant house academy detroit southwest site"
grand traverse academy,7348,D,grand traverse academy,Mustangs,"grand traverse academy, academic and career education academy"
detroit cristo rey,7349,C,detroit cristo rey hs,Wolves,"detroit cristo rey high school, covenant house academy detroit central site"
coolidge middle school,7350,,coolidge middle school,,"academy for business and technology high school, academy of the americas high school"
plymouth east middle school,7351,,east middle school,,"academy for business and technology high school, actech high school"
midland - central middle school,7352,,central middle school,,"academy for business and technology high school, actech high school"
warren michigan collegiate middle school,7353,,michigan collegiate middle school,,"actech high school, addison high school"
jhs1,7354,,jhs1,,
rochester west middle school,7355,,west middle school,Warriors,"west middle school, academy for business and technology high school"
plymouth west middle school,7356,,west middle school,Bulldogs,"west middle school, academy for business and technology high school"
ruben daniels ms,7357,,ruben daniels middle school,,
dearborn heights riverside middle school,7358,,riverside middle school,,"actech high school, addison high school"
willie e.thompson ,7359,,willie e.thompson ,,wylie e groves high school
east middle school,7360,,east middle school,,"west middle school, hart middle school"
monroe jefferson middle school,7361,,jefferson middle school,,"academy for business and technology high school, actech high school"
waterford mason middle school,7362,,mason middle school,,"academy for business and technology high school, actech high school"
fowler waldron middle school,7363,,waldron middle school,,"academy for business and technology high school, actech high school"
harrison middle school,7364,,harrison middle school,,"academy for business and technology high school, academy of the americas high school"
st clair shores jefferson middle school,7365,,jefferson middle school,,"actech high school, addison high school"
grosse pointe pierce middle school,7366,,pierce middle school,,"actech high school, addison high school"
mason middle school,7367,,mason middle school,,"academy for business and technology high school, academy of the americas high school"
comstock middle school,7368,,comstock middle school,,"academy for business and technology high school, academy of the americas high school"
pontiac lincoln middle school,7369,,lincoln middle school,,"academy for business and technology high school, actech high school"
washington middle school,7370,,washington middle school,,"academy for business and technology high school, alba school"
warren carter middle school,7371,,carter middle school,,"academy for business and technology high school, actech high school"
marshall middle school,7372,,marshall middle school,,"academy for business and technology high school, academy of the americas high school"
ypsilanti east middle school,7373,,east middle school,,"academy for business and technology high school, actech high school"
jefferson middle school,7374,,jefferson middle school,,"academy for business and technology high school, academy of the americas high school"
ypsilanti community middle school,7375,,ypsilanti community middle school,,"actech high school, addison high school"
lincoln middle school,7376,,lincoln middle school,,"academy for business and technology high school, academy of the americas high school"
mcbride middle school,7377,,mcbride middle school,,"academy for business and technology high school, academy of the americas high school"
port huron central middle school,7378,,central middle school,,"actech high school, addison high school"
canton - central middle school,7379,,central middle school,Chargers,"academy for business and technology high school, actech high school"
swartz creek st mary jhs,7380,,st mary jhs,,"st charles community middlehigh school, st clair county intervention academy"
lake leelanau st mary middle school,7381,,st mary middle school,,"actech high school, addison high school"
rochester hart middle school,7382,,hart middle school,,"hart middle school, academy for business and technology high school"
unionville st paul lutheran jhs,7383,,st paul lutheran jhs,,"st clair high school, st johns high school"
manistee trinity lutheran jhs,7384,,trinity lutheran jhs,,
northville hillside middle school,7385,,hillside middle school,,"actech high school, addison high school"
muskegon trinity lutheran school,7386,,trinity lutheran school,,"actech high school, addison high school"
st joseph jhs,7387,,st joseph jhs,,"link learning st louis, st charles community middlehigh school"
detroit wilson middle school,7388,,wilson middle school,,"academy for business and technology high school, actech high school"
detroit longfellow middle school,7389,,longfellow middle school,,"actech high school, addison high school"
grand rapids northeast middle school,7390,,northeast middle school,,"actech high school, addison high school"
norway vulcan middle school,7391,,vulcan middle school,,"academy for business and technology high school, actech high school"
waterford pierce middle school,7392,,pierce middle school,Pirates,"academy for business and technology high school, actech high school"
traverse city trinity lutheran school,7393,,trinity lutheran school,,"actech high school, addison high school"
comstock park mill creek middle school,7394,,mill creek middle school,,"actech high school, addison high school"
okemos chippewa middle school,7395,,chippewa middle school,Wolves,"academy for business and technology high school, actech high school"
detroit webber middle school,7396,,webber middle school,,"academy for business and technology high school, actech high school"
detroit farwell middle school,7397,,farwell middle school,,"academy for business and technology high school, actech high school"
taylor west middle school,7398,,west middle school,,"west middle school, academy for business and technology high school"
pontiac middle school,7399,,pontiac middle school,,"academy for business and technology high school, academy of the americas high school"
grand haven lakeshore middle school,7400,,lakeshore middle school,,"actech high school, addison high school"
warren zoe christian academy,7401,,zoe christian academy,,"academy 21, academy for business and technology high school"
sturgis trinity lutheran school,7402,,trinity lutheran school,,"academy for business and technology high school, actech high school"
st joseph school,7403,,st joseph school,,"st joseph high school, academy for business and technology high school"
hillsdale academy 6/7/8,7404,,hillsdale academy 6/7/8,,"hillsdale academy, academic and career education academy"
sawyer trinity lutheran school,7405,,trinity lutheran school,,"academy for business and technology high school, actech high school"
detroit academy of arts & sciences jhs,7406,,detroit academy of arts & sciences jhs,,"54th street academy, academy 21"
pontiac academy for excellence 6-8,7407,,pontiac academy for excellence 6-8,,"pontiac academy for excellence, 54th street academy"
zion christian middle school,7408,,zion christian middle school,,"zion christian school, academy for business and technology high school"
frontier international academy 7/8,7409,,frontier international academy 7/8,,"frontier international academy, international academy"
grand rapids potter's house ms,7410,,the potter's house ms,,"covenant house academy detroit southwest site, potters house school"
cadillac mackinaw trail,7411,,mackinaw trail middle school,Vikings,
detroit burns,7412,,burns elementary middle school,,"covenant house academy detroit central site, covenant house academy detroit east site"
detroit parker,7413,,parker middle school,,"covenant house academy detroit central site, covenant house academy detroit east site"
detroit richard ms,7414,,richard middle school,,"covenant house academy detroit central site, covenant house academy detroit east site"
detroit stewart,7415,,stewart middle school,,"covenant house academy detroit central site, covenant house academy detroit east site"
zeeland borculo christian,7416,,borculo christian school,,"detroit christian schools of excellence, grandville calvin christian high school"
jackson trinity,7417,,trinity lutheran school,,"east jackson secondary school, jackson area career center"
oak park preparatory academy,7418,,oak park preparatory academy,,"academy 21, academy for business and technology high school"
ypsilanti calvary christian ms,7419,,calvary christian academy,,
st peter's lutheran school,7420,,st peter's lutheran school,,"academy for business and technology high school, alba school"
kalamazoo linden grove,7421,,linden grove middle school,,"kalamazoo area math and science center, kalamazoo county juvenile home youth center school"
grand rapids university prep ,7422,,university prep academy,U Prep,"grand rapids university preparatory academy, university preparatory academy psad high school"
keshena menominee indian (wi),7423,,menominee indian hs,,
onalaksa (wi),7425,,onalaska high school,,
west chicago wheaton academy (il),7426,,wheaton academy,,"54th street academy, academy 21"
lake forest academy (il),7427,,lake forest academy,,"academic and career education academy, academy 21"
jackson living word lutheran (wi),7428,,living word lutheran,,"jackson county jail, jackson high school"
menominee indian (wi),7429,,menominee indian,,menominee isd special education
oos(7),7430,,oos7,,
london st thomas aquinas (cn),7431,,st thomas aquinas,,"virtual learning academyof st clair county, st mary school"
whitehall (wi),7432,,whitehall,,whitehall senior high school
wautoma high school (wi),7433,,wautoma high school,,"high school, academy for business and technology high school"
lincoln-way central (il),7434,,lincoln-way central,,"central academy, central michigan correctional facility"
lincoln-way east (il),7435,,lincoln-way east,,"covenant house academy detroit east site, east english village preparatory academy"
lincoln-way north (il),7436,,lincoln-way north,,"lincoln school, north adamsjerome middlehigh school"
homewood-flossmoor (il),7437,,homewood-flossmoor,,
stagg (il),7438,,stagg,,
fort zumwalt west (mo),7439,,fort zumwalt west,,"academy west alternative education, kalamazoo resa west campusyoung adult program"
hales franciscan (il),7440,,hales franciscan,,
maranatha baptist (wi),7441,,maranatha baptist,,community baptist christian school
danville schlarman (il),7442,,danville schlarman,,
bear creek (cn),7443,,bear creek,,"battle creek area learning center, battle creek central high school"
collingwood collegiate (cn),7444,,collingwood collegiate,,detroit collegiate preparatory high school at northwestern
laurier ss (cn),7445,,laurier ss,,
maple (cn),7446,,maple hs,,"maple grove alternative high school, maple valley jrsr high school"
markham (cn),7447,,markham district hs,,
king city (cn),7448,,king city ss,,"bay city academy farragut campus, bay city adult educationctp"
newmarket huron heights (cn),7449,,huron heights ss,,"huron high school, huron high school"
markham brother andre catholic (cn),7450,,brother andre catholic hs (cn),,hackett catholic prep
aurora g.w. williams (cn),7451,,g.w. williams ss,,
columbus bishop ready (oh),7452,,bishop ready hs,,
new lenox lincoln way west (il),7453,,lincoln way west hs,,"kalamazoo resa west campusyoung adult program, lincoln high school"
barron (wi),7454,,barron hs,,
bloomer (wi),7455,,bloomer hs,,
grantsburg (wi),7456,,grantsburg hs,,
sheboygan falls (wi),7457,,sheboygan falls hs,,
london clarke road (cn),7458,,clarke road secondary,,
poynette (wi),7459,,poynette,,
river valley (wi),7460,,river valley,,"black river public school middlehigh, chippewa valley adult and mohegan alt educ"
grand rapids (mn),7461,,grand rapids,,"big rapids virtual school, covenant house academy grand rapids"
crookston (mn),7462,,crookston,,
detroit lake (mn),7463,,detroit lake,,"ackerson lake community education, central lake public schools"
out of state13,7464,,out of state13,,"academy of science math and technology early college high sc, academy of the americas high school"
out of state14,7465,,out of state14,,"academy of science math and technology early college high sc, academy of the americas high school"
out of state15,7466,,out of state15,,"academy of science math and technology early college high sc, academy of the americas high school"
out of state16,7467,,out of state16,,"academy of science math and technology early college high sc, academy of the americas high school"
out of state17,7468,,out of state17,,"academy of science math and technology early college high sc, academy of the americas high school"
out of state18,7469,,out of state18,,"academy of science math and technology early college high sc, academy of the americas high school"
out of state19,7470,,out of state19,,"academy of science math and technology early college high sc, academy of the americas high school"
out of state20,7471,,out of state20,,"academy of science math and technology early college high sc, academy of the americas high school"
grand haven public schools,7882,,grand haven public schools,,"charlotte public schools project success, chesaning union schools alternative education"
holland area,8165,,holland area,,"allegan county area technical and education center, battle creek area learning center"
archdiocese of detroit (mic),8166,,archdiocese of detroit,,"academy of science math and technology early college high sc, alternative educational academy of iosco county"
warren zoe christian,8198,,zoe christian schools,,"warren consolidated community high school, warren woods tower high school"
wayne state university,8223,,wayne state university,,"grand rapids university preparatory academy, university preparatory academy psad high school"
manistee-casman academy,8228,,casman academy,,"academic and career education academy, academy 21"
kentwood grand river prep,8229,B,grand river prep,Titans,"dearborn newcomer college prep academy, grand rapids university preparatory academy"
manistee-casman academy 7/8,8230,,casman academy 7/8,,"academy 21, academy for business and technology high school"
burlington assumption (cn),8251,,assumption ss,,
burlington nelson (cn),8252,,nelson hs,,
oakville holy trinity (cn),8253,,holy trinity ss,,
woodson (dc),8254,,woodson hs,,
chicago golder college prep (il),8255,,golder college prep,,"academy of science math and technology early college high sc, sigma academy for leadership and early middle college"
chicago phoenix military academy (il),8256,,phoenix military academy,,"54th street academy, academy 21"
chicago raby (il),8257,,raby hs,,way academy chicago site
kankakee (il),8258,,kankakee hs,,
uccs woodlawn (il),8260,,university of chicago charter,,
wheeler (in),8261,,wheeler hs,,arts academy in the woods
hammond clark (in),8262,,hammond clark hs,,
cleveland st ignatius (oh),8263,,st ignatius hs,,"st charles community middlehigh school, virtual learning academyof st clair county"
wintersville indian creek (oh),8265,,indian creek hs,,
fairview (pa),8266,,fairview hs,,fairview school
independence gilmanton (wi),8267,,independence hs,,
oneida nation (wi),8268,,oneida nation hs,,
siren (wi),8269,,siren (wi),,
wheeling park (wv),8270,,wheeling park hs,,"allen park community school, chandler park academy high school"
oberlin (oh),8273,,oberlin hs,,
lancaster fairfield christian (oh),8274,,fairfield christian academy,,"faith christian school, faith christian school"
thompson ledgemont (oh),8275,,ledgemeont hs,,
youngstown christian (oh),8276,,youngstown christian hs,,"detroit christian schools of excellence, grandville calvin christian high school"
andover pymatuning valley (oh),8277,,pymatuning valley hs,,"huron valley womens, the valley school"
vienna mathews (oh),8278,,mathews hs,,
orwell grand valley (oh),8279,,grand valley hs,,"chippewa valley adult and mohegan alt educ, covenant house academy grand rapids"
windsor forster (cn),8280,,forster ss,,
windsor st joseph catholic (cn),8281,,st joseph catholic,,"st clair high school, st johns high school"
warren central (in),8282,,warren central hs,,"battle creek central high school, bay city central high school"
indianapolis chatard (in),8283,,chatard hs,,
naperville neuqua valley (il),8284,,neuqua valley hs,,"chippewa valley adult and mohegan alt educ, swan valley adult and alternative education"
bruce (wi),8285,,bruce hs,,
elmhurst immaculate conception (il),8286,,imaculate conception hs,,
hebron lakewood (oh),8287,,lakewood hs,,
covington holy cross (ky),8288,,holy cross hs,,
pittsburgh united military academy (pa),8289,,united military academy,,"54th street academy, academy 21"
genoa-kingston (il),8290,,genoa-kingston hs,,
marengo (il),8291,,marengo hs,,
elgin st edward (il),8292,,st edward hs,,"st charles community middlehigh school, st clair county intervention academy"
aurora marmion academy (il),8293,,marmion academy,,"academy 21, academy for business and technology high school"
lombard montini (il),8294,,montini hs,,
wheaton st francis (il),8295,,st francis hs,,"st charles community middlehigh school, st clair county intervention academy"
dekalb (in),8296,,dekalb (in),,arts academy in the woods
london montcalm (cn),8297,,montcalm ss,,"central montcalm middle high school, early college at montcalm community college"
london westminster (cn),8298,,westminster ss,,
watseka (il),8299,,watseka hs,,
kirkland hiawatha (il),8300,,hiawatha hs,,
ann arbor multicultural academy,8301,,multicultural academy,,"54th street academy, academy 21"
benton harbor dream academy (closed),8302,,dream academy hs,Toros,"54th street academy, academy 21"
monroe meadow montessori,8303,,meadow montessori,Wolves,"charlevoix montessori academy for the arts, howe trainable center and montessori"
meadow montessori jhs,8304,,meadow montessori jhs school,,"charlevoix montessori academy for the arts, grand rapids montessori middlehigh"
cincinnati horizon science acad (oh),8305,,horizon science academy,,"academy of science math and technology early college high sc, ca frost environmental science academy middle high school"
london holy cross (cn),8306,,holy cross hs,,
york weston (cn),8307,,westin ci,,
toronto forest hill (cn),8308,,forest hill ci,,hill center
tomlinson middle school,8309,,tomlinson middle school,,"academy for business and technology high school, academy of the americas high school"
eastpointe eaton academy 6/7/8,8310,,eaton academy ,,"54th street academy, academy 21"
toronto don bosco catholic (cn),8312,,don bosco catholic ss,,
toronto newtonbrook (cn),8313,,newtonbrook ss,,
detroit mcgivney,8315,,mcgivney academy:detroit,,"covenant house academy detroit central site, covenant house academy detroit east site"
detroit university prep art & design,8316,B,university prep art & design,Mustangs,"detroit collegiate preparatory high school at northwestern, detroit school of arts"
galien,8317,,galien alternative hs,,
galien jhs,8318,,galien jhs,,
burton madison academy,8319,C,madison academy,Eagles,"academic and career education academy, academy 21"
flint madison academy middle school,8320,,madison academy middle school,,"54th street academy, academy 21"
kimball landmark academy,8321,C,landmark academy,Lakers,"landmark academy, academic and career education academy"
kimball landmark acad middle school,8322,,landmark acad middle school,,"actech high school, addison high school"
washington-parks academy,8323,,washington-parks academy,,"academic and career education academy, academy 21"
holland heights,8326,,holland heights k-7,,"dearborn heights virtual academy, godwin heights learning center"
holland eight,8327,,holland eight @ hhs,Dutch,"holland virtual tech high school, calvary schools of holland"
holland jefferson,8328,,jefferson k-7,,"holland virtual tech high school, calvary schools of holland"
ann arbor washtenaw tech,8329,,washtenaw tech middle college,,"lisd tech center, van buren tech"
popular name,8330,,popular name,,
niagara hs (wi),8331,,niagara hs (wi),,"carsonvilleport sanilac hs, ea johnson memorial hs"
howards grove (wi),8332,,howards grove hs,,"lincolnking adams young school grove campus, maple grove alternative high school"
blair-taylor (wi),8333,,blair-taylor hs ,,"taylor career and technical center, taylor preparatory high school"
arcadia (wi),8334,,arcadia hs,,
eleva-strum (wi),8335,,eleva-strum hs,,
cochrane-fountain city (wi),8336,,cochrane-fountain city hs,,"city middlehigh, dollar baytamarack city area k12 school"
alma center lincoln (wi),8337,,lincoln hs,,"allegan county area technical and education center, apollo center"
melrose-mindoro (wi),8338,,melrose-mindoro hs,,
hunting valley university school (oh),8339,,university school,,"actech high school, addison high school"
cleveland central catholic (oh),8340,,cleveland central catholic hs,,"central academy, central high school"
hamilton st thomas more (cn),8341,,st thomas more catholic secondary school,,"hamilton flex, virtual learning academyof st clair county"
bryan (oh),8342,,bryan hs,,
mundelein carmel (il),8343,,carmel hs,,
arlington heights st viator (il),8344,,st viator hs,,"st clair high school, st johns high school"
henderson county (ky),8345,,henderson county hs,,"allegan county area technical and education center, alternative educational academy of iosco county"
evansville memorial (in),8346,,memorial hs,,
calumet heritage christian (in),8347,,heritage christian hs,,"calumet high school, heritage high school"
hermantown (mn),8348,,hermantown hs,,
